{
  "id": "spec_astroduck_explosions_vfx",
  "projectId": "astroduck_demo",
  "specListId": "specList_astroduck_demo",
  "createdAt": "2026-02-03T00:00:00.000Z",
  "updatedAt": "2026-02-05T16:33:27.908Z",
  "title": "Explosions + hit sparks (small/medium/large)",
  "assetType": "spritesheet",
  "style": "comic",
  "scenario": "scifi",
  "tags": [
    "assetType:spritesheet",
    "vfx:explosion",
    "vfx:hit",
    "style:comic"
  ],
  "output": {
    "kind": "animation",
    "background": "transparent_required",
    "animation": {
      "fps": 14,
      "loop": false,
      "frameCount": 10
    }
  },
  "prompt": {
    "positive": "sci-fi comic, bold outlines, high contrast, clean shapes, Small/medium/large explosion sprites, stylized comic burst, bright orange/yellow, thick outlines, multi-frame loop, transparent background",
    "negative": "(worst quality, low quality, illustration, 3d, 2d), open mouth, tooth, ugly face, old face, long neck, photo, smoke-heavy, noisy, text, watermark"
  },
  "generationParams": {
    "width": 512,
    "height": 512,
    "variants": 4
  },
  "status": "deprecated",
  "checkpointId": "copaxTimeless_xivSDXL.safetensors"
}
