{
  "id": "spec_astroduck_muzzle_flash_",
  "projectId": "astroduck_demo",
  "specListId": "specList_astroduck_demo",
  "createdAt": "2026-02-05T16:06:05.302Z",
  "updatedAt": "2026-02-05T16:33:27.912Z",
  "title": "Muzzle flash: Spread",
  "assetType": "spritesheet",
  "style": "comic",
  "scenario": "scifi",
  "tags": [
    "assetType:spritesheet",
    "vfx:muzzle_flash",
    "weapon:player",
    "muzzle:spread",
    "style:comic"
  ],
  "output": {
    "kind": "animation",
    "background": "transparent_required",
    "animation": {
      "fps": 18,
      "loop": true,
      "frameCount": 6
    }
  },
  "prompt": {
    "positive": "sci-fi comic, bold outlines, high contrast, clean shapes, spread muzzle flash, short wide burst, transparent background, loopable frames",
    "negative": "(worst quality, low quality, illustration, 3d, 2d), open mouth, tooth, ugly face, old face, long neck, photo, smoke-heavy, watermark, text"
  },
  "generationParams": {
    "width": 512,
    "height": 512,
    "variants": 4
  },
  "status": "deprecated",
  "checkpointId": "copaxTimeless_xivSDXL.safetensors"
}
