{
  "id": "spec_astroduck_impact_seq",
  "projectId": "astroduck_demo",
  "specListId": "specList_astroduck_demo",
  "createdAt": "2026-02-05T16:38:30.561Z",
  "updatedAt": "2026-02-05T19:52:54.686Z",
  "title": "Impact sparks: Large (sequence)",
  "assetType": "spritesheet",
  "style": "comic",
  "scenario": "scifi",
  "tags": [
    "assetType:spritesheet",
    "vfx:impact",
    "impact:large",
    "style:comic"
  ],
  "output": {
    "kind": "animation",
    "background": "transparent_required",
    "animation": {
      "fps": 16,
      "loop": true,
      "frameCount": 8,
      "frameNames": [
        "frame_01",
        "frame_02",
        "frame_03",
        "frame_04",
        "frame_05",
        "frame_06",
        "frame_07",
        "frame_08"
      ],
      "framePrompts": [
        "impact burst, sharp spark",
        "impact burst, expanding sparks",
        "impact burst, peak glow",
        "impact burst, trailing sparks",
        "impact fade, dim glow",
        "impact fade, smoke wisps",
        "impact fade, embers",
        "impact fade, clear"
      ]
    }
  },
  "prompt": {
    "positive": "sci-fi comic, bold outlines, high contrast, clean shapes, large impact sparks, wide burst with shards, transparent background, loopable frames",
    "negative": "(worst quality, low quality, illustration, 3d, 2d), open mouth, tooth, ugly face, old face, long neck, photo, clutter, watermark, text"
  },
  "generationParams": {
    "width": 512,
    "height": 512,
    "variants": 4,
    "autoBgRemove": true,
    "steps": 22
  },
  "status": "ready",
  "checkpointId": "copaxTimeless_xivSDXL.safetensors"
}
