{
    "id":  "spec_astroduck_difficulty_selector",
    "projectId":  "astroduck_demo",
    "specListId":  "specList_astroduck_demo",
    "createdAt":  "2026-02-03T00:00:00.000Z",
    "updatedAt":  "2026-02-05T16:06:05.302Z",
    "title":  "Difficulty selector UI (easy/normal/hard) states",
    "assetType":  "ui_icon",
    "style":  "comic",
    "scenario":  "scifi",
    "tags":  [
                 "assetType:ui_icon",
                 "ui:difficulty",
                 "style:comic"
             ],
    "output":  {
                   "kind":  "ui_states",
                   "background":  "transparent_required",
                   "uiStates":  {
                                    "states":  [
                                                   "easy",
                                                   "normal",
                                                   "hard",
                                                   "selected"
                                               ]
                                }
               },
    "prompt":  {
                   "positive":  "sci-fi comic, bold outlines, high contrast, clean shapes, Difficulty selector UI: easy/normal/hard toggle states, sci-fi comic panels, neon highlights, consistent spacing, transparent background",
                   "negative":  "(worst quality, low quality, illustration, 3d, 2d), open mouth, tooth, ugly face, old face, long neck, photo, watermark, tiny text, inconsistent style"
               },
    "generationParams":  {
                             "width":  512,
                             "height":  256,
                             "variants":  4
                         },
    "status":  "deprecated",
    "checkpointId":  "copaxTimeless_xivSDXL.safetensors"
}