{
  "id": "spec_astroduck_level_backgrounds",
  "projectId": "astroduck_demo",
  "specListId": "specList_astroduck_demo",
  "createdAt": "2026-02-03T00:00:00.000Z",
  "updatedAt": "2026-02-03T00:00:00.000Z",
  "title": "Level backgrounds (Earth/Mars/Sun)",
  "assetType": "texture",
  "style": "comic",
  "scenario": "scifi",
  "tags": [
    "assetType:texture",
    "bg:level",
    "theme:scifi",
    "style:comic"
  ],
  "output": {
    "kind": "single_image",
    "background": "any"
  },
  "prompt": {
    "positive": "Wide horizontal shooter background, bold comic style, layered parallax feel, high contrast, space glow",
    "negative": "photo, watermark, low contrast, muddy colors"
  },
  "generationParams": {
    "width": 2048,
    "height": 1024,
    "variants": 3
  },
  "tier": 0,
  "status": "ready",
  "checkpointId": "ckpt_sd15_demo"
}
