{
  "id": "spec_astroduck_boss3_solar_entity",
  "projectId": "astroduck_demo",
  "specListId": "specList_astroduck_demo",
  "createdAt": "2026-02-03T00:00:00.000Z",
  "updatedAt": "2026-02-03T00:00:00.000Z",
  "title": "Boss 3: solar entity (idle + attack frames)",
  "assetType": "spritesheet",
  "style": "comic",
  "scenario": "scifi",
  "tags": ["assetType:spritesheet", "enemy:boss", "boss:3", "level:sun", "style:comic"],
  "output": {
    "kind": "animation",
    "background": "transparent_required",
    "animation": { "fps": 10, "loop": true, "frameCount": 12 }
  },
  "prompt": {
    "positive": "Giant solar alien entity boss sprite, fiery aura, plasma tendrils, sci-fi comic style, transparent background, clean alpha edges",
    "negative": "photo, watermark, text, smoky realistic fire, clutter"
  },
  "generationParams": { "width": 1280, "height": 1024, "variants": 12 },
  "status": "ready"
}

