{
  "id": "spec_astroduck_enemy_turret_seq",
  "projectId": "astroduck_demo",
  "specListId": "specList_astroduck_demo",
  "createdAt": "2026-02-05T16:38:30.561Z",
  "updatedAt": "2026-02-05T19:52:54.686Z",
  "title": "Enemy: alien turret (idle + shoot) (sequence)",
  "assetType": "spritesheet",
  "style": "comic",
  "scenario": "scifi",
  "tags": [
    "assetType:spritesheet",
    "enemy:turret",
    "faction:aliens",
    "style:comic"
  ],
  "output": {
    "kind": "animation",
    "background": "transparent_required",
    "animation": {
      "fps": 10,
      "loop": true,
      "frameCount": 8,
      "frameNames": [
        "frame_01",
        "frame_02",
        "frame_03",
        "frame_04",
        "frame_05",
        "frame_06",
        "frame_07",
        "frame_08"
      ],
      "framePrompts": [
        "idle, turret scanning center",
        "idle, turret scanning left",
        "idle, turret scanning right",
        "idle, turret recenters",
        "charge, barrel glow building",
        "fire, muzzle flash",
        "recoil, barrel kickback",
        "reset, smoke fade"
      ]
    }
  },
  "prompt": {
    "positive": "sci-fi comic, bold outlines, high contrast, clean shapes, Enemy ground turret sprite, chunky sci-fi cannon, glowing muzzle, comic shading, transparent background, idle + shoot frames consistent",
    "negative": "(worst quality, low quality, illustration, 3d, 2d), open mouth, tooth, ugly face, old face, long neck, photo, clutter, text, watermark"
  },
  "generationParams": {
    "width": 512,
    "height": 512,
    "variants": 4,
    "autoBgRemove": true,
    "steps": 22
  },
  "status": "ready",
  "checkpointId": "copaxTimeless_xivSDXL.safetensors"
}
