{
  "id": "spec_astroduck_warp_effect",
  "projectId": "astroduck_demo",
  "specListId": "specList_astroduck_demo",
  "createdAt": "2026-02-03T00:00:00.000Z",
  "updatedAt": "2026-02-05T16:33:27.915Z",
  "title": "Warp transition effect (looping)",
  "assetType": "spritesheet",
  "style": "comic",
  "scenario": "scifi",
  "tags": [
    "assetType:spritesheet",
    "vfx:warp",
    "transition",
    "style:comic"
  ],
  "output": {
    "kind": "animation",
    "background": "transparent_required",
    "animation": {
      "fps": 18,
      "loop": true,
      "frameCount": 12
    }
  },
  "prompt": {
    "positive": "sci-fi comic, bold outlines, high contrast, clean shapes, Warp transition VFX, swirling tunnel with bright core, streaking stars, smooth gradients, loopable frames, transparent background",
    "negative": "(worst quality, low quality, illustration, 3d, 2d), open mouth, tooth, ugly face, old face, long neck, photo, clutter, banding, watermark, text"
  },
  "generationParams": {
    "width": 1024,
    "height": 512,
    "variants": 4
  },
  "status": "deprecated",
  "checkpointId": "copaxTimeless_xivSDXL.safetensors"
}
