{
  "id": "spec_astroduck_player_ship_seq",
  "projectId": "astroduck_demo",
  "specListId": "specList_astroduck_demo",
  "createdAt": "2026-02-05T16:38:30.561Z",
  "updatedAt": "2026-02-05T19:52:54.686Z",
  "title": "AstroDuck flight vehicle (idle + bank) (sequence)",
  "assetType": "spritesheet",
  "style": "comic",
  "scenario": "scifi",
  "tags": [
    "assetType:spritesheet",
    "player:ship",
    "theme:scifi",
    "style:comic"
  ],
  "output": {
    "kind": "animation",
    "background": "transparent_required",
    "animation": {
      "fps": 12,
      "loop": true,
      "frameCount": 6,
      "frameNames": [
        "frame_01",
        "frame_02",
        "frame_03",
        "frame_04",
        "frame_05",
        "frame_06"
      ],
      "framePrompts": [
        "idle, centered, slight bob",
        "idle, centered, engine glow",
        "idle, centered, subtle sway",
        "bank left, ship tilts left",
        "bank right, ship tilts right",
        "return to center"
      ]
    }
  },
  "prompt": {
    "positive": "sci-fi comic, bold outlines, high contrast, clean shapes, AstroDuck piloting a compact sci-fi ship, duck-beak nosecone, teal/orange cockpit glow, bold comic outlines, clean silhouette, consistent lighting, transparent background, animation frames consistent",
    "negative": "(worst quality, low quality, illustration, 3d, 2d), open mouth, tooth, ugly face, old face, long neck, photo, text, watermark, messy background, inconsistent lighting, extreme perspective"
  },
  "generationParams": {
    "width": 512,
    "height": 512,
    "variants": 4,
    "autoBgRemove": true,
    "steps": 22
  },
  "status": "ready",
  "checkpointId": "copaxTimeless_xivSDXL.safetensors"
}
