{
  "id": "spec_astroduck_boss2_drilling_core",
  "projectId": "astroduck_demo",
  "specListId": "specList_astroduck_demo",
  "createdAt": "2026-02-03T00:00:00.000Z",
  "updatedAt": "2026-02-05T16:33:27.906Z",
  "title": "Boss 2: Mars drilling core (idle + attack frames)",
  "assetType": "spritesheet",
  "style": "comic",
  "scenario": "scifi",
  "tags": [
    "assetType:spritesheet",
    "enemy:boss",
    "boss:2",
    "level:mars",
    "style:comic"
  ],
  "output": {
    "kind": "animation",
    "background": "transparent_required",
    "animation": {
      "fps": 10,
      "loop": true,
      "frameCount": 10
    }
  },
  "prompt": {
    "positive": "sci-fi comic, bold outlines, high contrast, clean shapes, Boss 2 drilling core sprite, massive industrial drill, molten glow, Mars dust accents, bold comic style, transparent background, idle + attack frames consistent",
    "negative": "(worst quality, low quality, illustration, 3d, 2d), open mouth, tooth, ugly face, old face, long neck, photo, watermark, text, messy background"
  },
  "generationParams": {
    "width": 1024,
    "height": 1024,
    "variants": 4
  },
  "status": "deprecated",
  "checkpointId": "copaxTimeless_xivSDXL.safetensors"
}
