{
    "id":  "spec_astroduck_weapon_projectiles",
    "projectId":  "astroduck_demo",
    "specListId":  "specList_astroduck_demo",
    "createdAt":  "2026-02-03T00:00:00.000Z",
    "updatedAt":  "2026-02-05T16:06:05.302Z",
    "title":  "Weapon projectiles (laser/plasma/spread/missile)",
    "assetType":  "spritesheet",
    "style":  "comic",
    "scenario":  "scifi",
    "tags":  [
                 "assetType:spritesheet",
                 "vfx:projectile",
                 "weapon:player",
                 "style:comic"
             ],
    "output":  {
                   "kind":  "animation",
                   "background":  "transparent_required",
                   "animation":  {
                                     "fps":  16,
                                     "loop":  true,
                                     "frameCount":  8
                                 }
               },
    "prompt":  {
                   "positive":  "sci-fi comic, bold outlines, high contrast, clean shapes, Set of player projectiles: laser beam, plasma orb, spread shot; bright core with glow, simple shapes, consistent scale, transparent background",
                   "negative":  "(worst quality, low quality, illustration, 3d, 2d), open mouth, tooth, ugly face, old face, long neck, photo, clutter, text, watermark, low contrast"
               },
    "generationParams":  {
                             "width":  512,
                             "height":  512,
                             "variants":  4
                         },
    "status":  "deprecated",
    "checkpointId":  "copaxTimeless_xivSDXL.safetensors"
}