{
  "id": "spec_astroduck_boss3_solar_entity_seq",
  "projectId": "astroduck_demo",
  "specListId": "specList_astroduck_demo",
  "createdAt": "2026-02-05T16:38:30.561Z",
  "updatedAt": "2026-02-05T19:52:54.686Z",
  "title": "Boss 3: solar entity (idle + attack frames) (sequence)",
  "assetType": "spritesheet",
  "style": "comic",
  "scenario": "scifi",
  "tags": [
    "assetType:spritesheet",
    "enemy:boss",
    "boss:3",
    "level:sun",
    "style:comic"
  ],
  "output": {
    "kind": "animation",
    "background": "transparent_required",
    "animation": {
      "fps": 10,
      "loop": true,
      "frameCount": 12,
      "frameNames": [
        "frame_01",
        "frame_02",
        "frame_03",
        "frame_04",
        "frame_05",
        "frame_06",
        "frame_07",
        "frame_08",
        "frame_09",
        "frame_10",
        "frame_11",
        "frame_12"
      ],
      "framePrompts": [
        "idle, soft solar glow, calm aura",
        "idle, glow intensifies slightly",
        "idle, light rays expand",
        "idle, corona flicker",
        "idle, energy swirl clockwise",
        "idle, energy swirl counterclockwise",
        "charge, core brightening",
        "charge, flare buildup",
        "burst, solar flare eruption",
        "burst, peak brightness",
        "cooldown, flare dissipating",
        "cooldown, return to idle glow"
      ]
    }
  },
  "prompt": {
    "positive": "sci-fi comic, bold outlines, high contrast, clean shapes, Boss 3 solar entity sprite, gigantic fiery alien, corona flames, bright core, bold comic shading, transparent background, idle + attack frames consistent",
    "negative": "(worst quality, low quality, illustration, 3d, 2d), open mouth, tooth, ugly face, old face, long neck, photo, watermark, text, muddy glow"
  },
  "generationParams": {
    "width": 512,
    "height": 512,
    "variants": 4,
    "autoBgRemove": true,
    "steps": 22
  },
  "status": "ready",
  "checkpointId": "copaxTimeless_xivSDXL.safetensors"
}
