{
  "id": "spec_astroduck_projectile_seq",
  "projectId": "astroduck_demo",
  "specListId": "specList_astroduck_demo",
  "createdAt": "2026-02-05T16:38:30.561Z",
  "updatedAt": "2026-02-05T19:52:54.686Z",
  "title": "Projectile: Missile (sequence)",
  "assetType": "spritesheet",
  "style": "comic",
  "scenario": "scifi",
  "tags": [
    "assetType:spritesheet",
    "vfx:projectile",
    "weapon:player",
    "projectile:missile",
    "style:comic"
  ],
  "output": {
    "kind": "animation",
    "background": "transparent_required",
    "animation": {
      "fps": 16,
      "loop": true,
      "frameCount": 8,
      "frameNames": [
        "frame_01",
        "frame_02",
        "frame_03",
        "frame_04",
        "frame_05",
        "frame_06",
        "frame_07",
        "frame_08"
      ],
      "framePrompts": [
        "missile launch, bright nose",
        "missile travel, short trail",
        "missile travel, longer trail",
        "missile travel, steady glow",
        "missile travel, exhaust flicker",
        "missile travel, exhaust flicker",
        "missile travel, slight wobble",
        "missile fade, glow dim"
      ]
    }
  },
  "prompt": {
    "positive": "sci-fi comic, bold outlines, high contrast, clean shapes, missile projectile, small rocket with flame, transparent background, loopable frames",
    "negative": "(worst quality, low quality, illustration, 3d, 2d), open mouth, tooth, ugly face, old face, long neck, photo, clutter, text, watermark, low contrast"
  },
  "generationParams": {
    "width": 512,
    "height": 512,
    "variants": 4,
    "autoBgRemove": true,
    "steps": 22
  },
  "status": "ready",
  "checkpointId": "copaxTimeless_xivSDXL.safetensors"
}
