{
  "id": "spec_astroduck_enemy_drone",
  "projectId": "astroduck_demo",
  "specListId": "specList_astroduck_demo",
  "createdAt": "2026-02-03T00:00:00.000Z",
  "updatedAt": "2026-02-03T00:00:00.000Z",
  "title": "Enemy: alien drone (idle loop)",
  "assetType": "spritesheet",
  "style": "comic",
  "scenario": "scifi",
  "tags": ["assetType:spritesheet", "enemy:drone", "faction:aliens", "style:comic"],
  "output": {
    "kind": "animation",
    "background": "transparent_required",
    "animation": {
      "fps": 12,
      "loop": true,
      "frameCount": 6
    }
  },
  "prompt": {
    "positive": "Alien drone enemy sprite, sci-fi comic style, bright accent lights, clear silhouette, transparent background",
    "negative": "photo, watermark, text, blurry edges, background"
  },
  "generationParams": {
    "width": 512,
    "height": 512,
    "variants": 8
  },
  "tier": 0,
  "status": "ready",
  "checkpointId": "ckpt_sd15_demo"
}
