{
  "id": "spec_astroduck_enemy_fighter",
  "projectId": "astroduck_demo",
  "specListId": "specList_astroduck_demo",
  "createdAt": "2026-02-03T00:00:00.000Z",
  "updatedAt": "2026-02-05T16:33:27.908Z",
  "title": "Enemy: alien fighter (idle loop)",
  "assetType": "spritesheet",
  "style": "comic",
  "scenario": "scifi",
  "tags": [
    "assetType:spritesheet",
    "enemy:fighter",
    "faction:aliens",
    "style:comic"
  ],
  "output": {
    "kind": "animation",
    "background": "transparent_required",
    "animation": {
      "fps": 12,
      "loop": true,
      "frameCount": 6
    }
  },
  "prompt": {
    "positive": "sci-fi comic, bold outlines, high contrast, clean shapes, Enemy fighter sprite, sleek alien ship, red/purple highlights, bold comic outlines, clean silhouette, transparent background, idle loop consistency",
    "negative": "(worst quality, low quality, illustration, 3d, 2d), open mouth, tooth, ugly face, old face, long neck, photo, clutter, text, watermark, tiny details"
  },
  "generationParams": {
    "width": 512,
    "height": 512,
    "variants": 4
  },
  "status": "deprecated",
  "checkpointId": "copaxTimeless_xivSDXL.safetensors"
}
